Papel,Segmento,Cotação,FFO Yield,Dividend Yield,P/VP,Valor de Mercado,Liquidez,Qtd de imóveis,Preço do m2,Aluguel por m2,Cap Rate,Vacância Média,Endereço
ABCP11,Shoppings,6410,"24,70%","9,33%",70,301.852.000,72.501,1,"3.957,79","1.294,47","32,71%","2,76%","Avenida Industrial, 600, Centro, Santo André - SP"
AFCR11,Híbrido,10315,"11,23%","0,00%",99,186.437.000,0,0,000,000,"0,00%","0,00%",
AFHI11,Títulos e Val. Mob.,9420,"9,39%","14,82%",99,284.432.000,748.441,0,000,000,"0,00%","0,00%",
AIEC11,Lajes Corporativas,6166,"14,90%","15,16%",65,297.509.000,338.942,2,"12.608,50","2.260,90","17,93%","0,00%","Avenida das Nações Unidas, 14.171 - Chucri Zaidan - São Paulo - SP,Avenida Presidente Wilson, 118 - Centro - Rio de Janeiro - RJ"
ALMI11,Lajes Corporativas,84800,"1,87%","0,00%",42,94.278.100,26.527,1,"2.083,31",17158,"8,24%","97,07%","Avenida Almirante Barroso, 81, Sem Complemento, Centro, Rio De Janeiro/RJ, Brasil, 20031-004"
ALZM11,Títulos e Val. Mob.,8398,"13,58%","7,33%",91,58.046.300,161.972,0,000,000,"0,00%","0,00%",
APTO11,Híbrido,830,"15,15%","15,47%",83,33.306.700,67.856,6,"12.852,10","1.001,32","7,79%","0,00%","Rua do Rócio nº 423 e Rua Fidêncio Ramos nº 420, no 28º Subdistrito - Jaridm Paulista, São Paulo - SP,Rua Jerônimo da Veiga nº 248, no 28º Subdistrito Jardim Paulista, São Paulo - SP,Rua Pedroso Alvarenga nºs 1256 e 1274, no 28º Subdistrito - Jardim Paulista, São Paulo - SP,Alameda Fernão Cardim, 70  Jardim Paulista  Estado de São Paulo,Rua Leopoldo Couto de Magalhães Júnior nº1098 e Rua Lopes Neto nº390, 28º Subdistrito - Jardim Paulista, São Paulo - SP,Alameda Fernão Cardim, 70 e 72  Jardim Paulista  Estado de São Paulo"
ARCT11,Híbrido,8713,"13,66%","14,62%",87,323.093.000,525.016,9,37615,3260,"8,67%","0,00%","Rodovia GO-070, Km 2 Qd. CH, Lt. 444, , Goiânia, GO, 74470-260,Rodovia Washington Luis KM 198, , Corumbataí, SP, 13540-000,Av. Santos Dumont 4305, Mirassol, SP, 15135-160,Rua Professor Luciano Prata 204, São Paulo, SP, 02510-020,Av. Costa e Silva 1275, Campo Grande, MS, 79050-410,Av. Perimetral Norte 10001, Goiânia, GO, 74583-285,Rod. Juscelino Kubitscheck de Oliveira - BR 364, Frutal, MG, 38200-000,Rodovia BR 060 KM 504, Goiânia, GO, 75800-001,Rodovia BR 020 572, Caucaia, CE, 061663-015"
ASMT11,Híbrido,6870,"13,49%","6,65%",82,69.889.600,5.479,3,"6.412,87",73400,"11,45%","0,00%","Avenida Alfredo Egidio De Souza Aranha, 145, Edifício Souza Aranha I, Vila Cruzeiro, Sao Paulo/SP, Brasil, 04726-170,Avenida Independencia, 565, Imóvel Porto Alegre, Independência, Porto Alegre/RS, Brasil, 00090-035,Avenida Alfredo Egidio De Souza Aranha, 145, Edifício Souza Aranha Ii, Vila Cruzeiro, Sao Paulo/SP, Brasil, 04726-170"
ATSA11,Shoppings,7495,"2,31%","0,47%",92,131.248.000,472,1,"3.831,45",10399,"2,71%","21,35%","Rua Giovanni Battista Pirelli, 155 - Vila Homero Thon - Santo André - SP"
BARI11,Títulos e Val. Mob.,8225,"14,05%","16,08%",86,381.162.000,754.977,1,000,000,"0,00%","0,00%",
BBFI11B,Lajes Corporativas,"2.040,01","16,31%","15,61%",72,265.201.000,287.316,2,"2.953,79",53213,"18,02%","0,00%","Sbs Quadra 1 Bloco E Lote 24, S/n, Sem Complemento, Asa Sul, Brasilia/DF, Brasil, 70072-900,Rua Barao De Sao Francisco, 177, Entrada Pela Rua Gomes Braga, 65, Andarai, Rio De Janeiro/RJ, Brasil, 20560-031"
BBFO11,Títulos e Val. Mob.,6649,"20,53%","13,25%",84,266.219.000,186.710,0,000,000,"0,00%","0,00%",
BBGO11,Títulos e Val. Mob.,7858,"12,17%","11,10%",80,314.726.000,223.275,0,000,000,"0,00%","0,00%",
BBPO11,Lajes Corporativas,8229,"12,47%","13,07%",82,1.310.030.000,1.414.150,63,"3.337,93",46542,"13,94%","0,00%","R. BENTO GONCALVES, 516, PASSO FUNDO-RS,R.XV DE NOVEMBRO,63/67, SOROCABA-SP,AV.BERNARDINO DE CAMPOS,250, SAO PAULO-SP,AV.CONSELHEIRO CARRAO,2411, SAO PAULO-SP,PCA.DAS 4 JORNADAS,11, CAMPOS DOS GOYTACAZES-RJ,ALAMEDA DOS JURUPIS, 1156, SAO PAULO-SP,R.CONDE BONFIM,369-A, RIO DE JANEIRO-RJ,R. JOAQUIM NABUCO, 246, SAO PAULO-SP,RUA HALFELD, 770 / ESQ. RUA MARECHAL DEODORO, 497, JUIZ FORA-MG,R.DR.NELSON D AVILA,149-CENTRO, SAO JOSE DOS CAMPOS-SP,PCA.CARDEAL ARCOVERDE,52, SAO CAETANO DO SUL-SP,R.JULIO CONCEICAO,438, SAO PAULO-SP,PRACA GENERAL VALADAO,377, ARACAJU-SE,R.DUQUE DE CAXIAS,725, RIBEIRAO PRETO-SP,RUA SAO BENTO, 483 / RUA LIBERO BADARO, 582, SAO PAULO-SP,PCA. RUI BARBOSA, 322, ARACATUBA-SP,AV.PRES.KENNEDY,1461, DUQUE DE CAXIAS-RJ,R.PINHEIROS,1492, SAO PAULO-SP,R.DA BAHIA,2500, BELO HORIZONTE-MG,AV.AFONSO PENA,2202, CAMPO GRANDE-MS,RUA XV DE NOVEMBRO, N. 191, SOROCABA-SP,PCA.RUI BARBOSA,1-55/R.ANT. ALVES, 9-38, BAURU-SP,AV.N.SRA.COPACABANA,594, RIO DE JANEIRO-RJ,RUA MARQUES DO HERVAL, 1354, EDIFICO SATELITE, CAXIAS DO SUL-RS,R.ESPIRITO SANTO,571, ESQ. C/ RUA CARIJÓS, 185, BELO HORIZONTE-MG,AV.ERNANI AMARAL PEIXOTO, 347, NITEROI-RJ,RUA 7 DE SETEMBRO, 1209, TOLEDO-PR,R.DR.COSTA AGUIAR,626, CAMPINAS-SP,RUA GUILHERME MOREIRA, 315, MANAUS-AM,R.VOLUNTARIOS DE S.PAULO,2975, SAO JOSE DO RIO PRETO-SP,R. FELINTO MULLER, 2104/PRES.JOSE LINHARES, 50, CUIABA-MT,AV.GOV.PEDRO DE TOLEDO,1099, CAMPINAS-SP,R.BOM PASTOR,153/169, SAO PAULO-SP,R.VOLUNTARIOS DA PATRIA,1769, SAO PAULO-SP,QD. 1, BL.G, LT. 32, BRASILIA-DF,SEPN QUADRA 504 BL B EDIFICIO VIRGO, BRASILIA-DF,PRACA XV DE NOVEMBRO, 321, FLORIANOPOLIS-SC,R.AUGUSTO RIBAS,555, PONTA GROSSA-PR,AV. GOIAS, 980 - QD.14, GOIANIA-GO,AV.SANTOS DUMONT,2889, FORTALEZA-CE,AV.13 DE MAIO,13, RIO DE JANEIRO-RJ,Praça XV de Novembro, 329, FLORIANOPOLIS-SC,AV.PRES.VARGAS,248, BELEM-PA,AV.BARTOLOMEU MITRE 438-A, RIO DE JANEIRO-RJ,R.BARORE,284, SAO PAULO-SP,R.NOSSA SENHORA DA LAPA, 281, SAO PAULO-SP,AV. AFONSO PENA, 745, ESQUINA R. QUINTINO BOCAIUVA, UBERLANDIA-MG,AV.RIO BRANCO,1437, SAO PAULO-SP,AV.DUQUE DE CAXIAS 448, MARINGA-PR,R.TAMOIOS,731/R. GUARANI, 504, BELO HORIZONTE-MG,R.HONORIO SILVEIRA DIAS,1830, PORTO ALEGRE-RS,AV.RANGEL PESTANA,2128, SAO PAULO-SP,AV.GEREMARIO DANTAS,78, RIO DE JANEIRO-RJ,R.PAULO EIRO,471/PRACA FLORIANO PEIXOTO, 254, SAO PAULO-SP,PCA.JOSE BONIFACIO,945, PIRACICABA-SP,AV W-3, Q.7, LT.7,8 E 9, BRASILIA-DF,AV.SANTA MARINA 2618, SAO PAULO-SP,AV.JABAQUARA 424, SAO PAULO-SP,PR.TIRADENTES,410/AL.DR. MURICY,760/R. CANDIDO LOP, CURITIBA-PR,R.DOMINGOS DE MORAES, 438, SAO PAULO-SP,SDN CONJ A LOJA C-03 2 PAVIMENTO, BRASILIA-DF,AV.PENHA DE FRANCA,549, SAO PAULO-SP,R.RIO DE JANEIRO,750, BELO HORIZONTE-MG"
BBRC11,Outros,9339,"12,36%","12,48%",87,148.490.000,97.196,20,"9.238,22","1.448,75","15,68%","0,00%","R. Joaquim Floriano, 666, São Paulo-SP,R. Coronel Quirino, 644, Campinas-SP,Av. Eng. Luis Carlos Berrini, 559, São Paulo-SP,Av. Eng. Heitor Antônio Eiras Garcia, 3963, São Paulo-SP,Av. Santo Amaro, 2163, São Paulo-SP,R. Pires da Mota, 488, São Paulo-SP,Al. Gabriel Monteiro da Silva, 2032, São Paulo-SP,R. Estados Unidos, 1931, São Paulo-SP,Av. Brasil, 418, São Paulo-SP,Av. Maria Servidei Demarchi, 1662, São Bernardo do Campo-SP,Av. Gal. Pedro Pinho, 641, Osasco-SP,R. Guaipá, 1389, São Paulo-SP,R. Marechal Deodoro, 440, São Paulo-SP,Av. Indianópolis, 546, São Paulo-SP,Av. Prof. Francisco Morato, 1214, São Paulo-SP,Av. Portugal, 519, Santo André-SP,Av. São Miguel, 2328, São Paulo-SP,Av. Prof. Francisco Morato, 2004, São Paulo-SP,Av. Paes de Barros, 2621, São Paulo-SP,Av. Amador Bueno da Veiga, 1516, São Paulo-SP"
BBVJ11,Lajes Corporativas,6299,"0,24%","0,00%",96,197.789.000,0,1,"9.380,79",40414,"4,31%","50,78%","Av. Magalhães de Castro, 4.800 - São Paulo/SP"
BCFF11,Títulos e Val. Mob.,6325,"16,37%","10,47%",86,1.593.040.000,2.240.300,0,000,000,"0,00%","0,00%",
BCIA11,Títulos e Val. Mob.,8260,"12,36%","10,71%",85,307.193.000,341.531,0,000,000,"0,00%","0,00%",
BCRI11,Títulos e Val. Mob.,9199,"14,87%","15,19%",92,575.662.000,566.083,0,000,000,"0,00%","0,00%",
BIME11,Híbrido,744,"15,34%","15,72%",83,43.491.300,71.164,2,"1.164,67",000,"0,00%","0,00%","Jamaris - Bairro Moema,Av. Indianópolis, 68"
BLCA11,Lajes Corporativas,11500,"5,70%","5,09%",81,184.000.000,45.548,1,"43.526,00","3.032,21","6,97%","0,00%","Avenida Brigadeiro Faria Lima, 3477, Itaim Bibi, Sao Paulo/SP, Brasil, 04538-133"
BLCP11,Logística,9100,"5,41%","4,42%",81,208.962.000,0,2,"3.014,16",19989,"6,63%","0,00%","Estrada Municipal Thereza Thomazella, 432, Bairro Dos Pires, Extrema/MG, Brasil, 37640-000,Rodovia Dom Gabriel Paulino Bueno Couto, Km 80,24, Cabreuva/SP, Brasil, 13315-000"
BLMC11,Títulos e Val. Mob.,7556,"13,14%","15,49%",79,30.186.200,4.012,0,000,000,"0,00%","0,00%",
BLMG11,Outros,6808,"12,75%","13,94%",72,259.425.000,507.888,1,30464,5732,"18,82%","0,00%","Cidade de Jandira, Comarca de Barueri, Estado de São Paulo."
BLMO11,Lajes Corporativas,"21.775,00","1,29%","1,57%",65,82.679.700,74.995,1,"12.833,10",46189,"3,60%","0,00%","Av. das Nações Unidas, nº 12.901, São Paulo - SP"
BLMR11,Títulos e Val. Mob.,638,"15,19%","13,69%",85,162.956.000,359.955,0,000,000,"0,00%","0,00%",
BMLC11,Híbrido,10050,"8,90%","8,89%",89,100.340.000,58.918,2,"13.569,90","1.263,19","9,31%","0,00%","Rua Lauro Muller, 116, 21º, 27º, 28º E 40º Andares, Botafogo, Rio De Janeiro/RJ, Brasil, 22290-160,Rua Joaquim Floriano, 466, Sem Complemento, Itaim Bibi, São Paulo/SP, Brasil, 04534-002"
BPFF11,Outros,6065,"19,46%","13,13%",85,272.460.000,307.657,0,000,000,"0,00%","0,00%",
BPML11,Shoppings,5850,"4,65%","4,67%",47,251.847.000,13.853,4,"3.242.490,00","673.199,86","20,76%","5,09%","Av. Maestro Paulo e Silva, 400, Shopping, Rio de Janeiro, RJ, 21920-445,Rua América Deolindo Garla, 224, Shopping, Lodrina, PR, 86079-225,Av. Severino Ballesteros, 850 - Cabral, Contagem - MG, 32110-005,Q. 107, Norte Avenida, NS 5, s/n, Shopping, Palmas, TO, 77001-098"
BPRP11,Outros,9127,"11,51%","11,44%",84,123.200.000,111,1,"5.338,59",63926,"11,97%","0,00%","Avenida Pl Do Brasil, 3001, Fontes, Aruja/SP, Brasil, 07415-000"
BRCO11,Logística,9313,"8,84%","8,55%",77,1.376.350.000,2.677.200,11,"3.086,39",31674,"10,26%","12,06%","Rodovia Dom Gabriel Paulino Bueno Couto nº 1936 - Itupeva - SP,Avenida Saul Elkin, Londrina - PR,Avenida Helio Ossamu Daikuara nº 1.135, Embu da Artes - SP,Rod. BA-535. km 23, Lauro de Freitas - BA,Rua Olympia Semerano, nº 381, 675 e 7337, São Paulo - SP,Estrada Turística do Jaraguá, nº 50, Jaraguá, São Paulo - SP,Rodovia Dom Gabriel Paulino Bueno Couto, nº 1606, Itupeva - SP,Avenida Tabai-Canoas (BR 386), nº 1.200, Canoas - RS,Avenida Marginal Direita do Tietê, nº 342, São Paulo - SP,Avenida D com acesso a Rodovia Presidente Dutra, KM 298, Resende - RJ,Avenida Wilson Tavares Ribeiro, nº 1.651 - Contagem - MG"
BRCR11,Híbrido,5503,"10,48%","10,38%",55,1.465.900.000,1.509.370,9,"9.829,49","1.196,88","12,18%","11,70%","Avenida Doutor Chucri Zaidan, 1240, Vila Sao Francisco Zona Sul, Sao Paulo/SP, Brasil, 04711-130,Avenida Das Nações Unidas 8501, Pinheiros, São Paulo, SP, 05425-070,Avenida Henrique Valadares, 28, Centro, Rio De Janeiro/RJ, Brasil, 00020-231,Rua Volkswagen 291, São Paulo/SP, Brasill, 04344-020,Rua Verbo Divino, 1488, Chácara Santo Antônio (zona Sul), São Paulo/SP, Brasil, 04719-002,Avenida João Cabral de Mello Neto 850, Rio de Janeiro, RJ, Brasil, 22775-057,Avenida Das Americas, 4200, Bloco 5, Barra Da Tijuca, Rio De Janeiro/RJ, Brasil, 22640-102,Avenida Das Nacoes Unidas, 14401, Vila Gertrudes, Sao Paulo/SP, Brasil, 04794-000,Avenida Indianopolis, 3096, Indianópolis, São Paulo/SP, Brasil, 04062-904"
BREV11,Híbrido,10300,"6,61%","7,26%",85,99.621.700,1.830,13,"17.365,50","1.417,05","8,16%","0,00%","Rua Fidêncio Ramos, 213 - São Paulo/SP,Alameda Itu, 852 - São Paulo/SP,Rua James Joule, 92 - São Paulo/SP,Avenida Brigadeiro Faria Lima, 3015 - São Paulo/SP,Avenida Doutor Cardoso de Melo, 1336 - São Paulo/SP,Rua Helena, 260 - São Paulo/SP,Rua Joaquim Floriano, 413 - São Paulo/SP,Rua Gomes de Carvalho, 1356 - São Paulo/SP,Rua Joaquim Floriano, 100 - São Paulo/SP,Rua Cristiano Viana, 401 - São Paulo/SP,Avenida Brigadeiro Faria Lima, 2055 - São Paulo/SP,Alameda Santos, 1940 - São Paulo/SP,Rua Tabapuã, 500"
BRIM11,Residencial,"1.030,22","9,08%","11,98%",94,127.888.000,0,4,68837,000,"0,00%","0,00%","Terreno Tumiaru, situado em rua Homônima,Andrade Fernandes, em Alto de Pinheiros,Rua do Estilo Barroco 623-665, Chácara Santo Antônio/SP,Rua Senador Pádua Sales, Pacaembu-SP"
BRLA11,Outros,13885,"5,40%","9,20%",88,392.605.000,143.684,6,"1.273,44",6948,"5,46%","0,00%","Km 101, Da Br-101, 101, Sem Complemento, , Conde/PB, Brasil, 58322-000,Rua Alexandre Barreto Cavalcante, 74, Lote 01b Quadra 07, Alterosa, Ribeirao Das Neves/MG, Brasil, 33821-105,Rua Jose Lana, 850, Sem Complemento, Brilhante I, Itajai/SC, Brasil, 88318-290,Rodovia Dos Imigrantes, Km 501, Sem Complemento, Distrito Industrial, Cuiaba/MT, Brasil, 78098-325,Estrada Ladeira Grande, S/n, Área 01-a, Parque Industrial, Viana/ES, Brasil, 29136-537,Setor 2, Setor 2, S/n, Lote 08b3, Setor 2, Lucas Do Rio Verde/MT, Brasil, 78455-000"
BTAL11,Outros,8700,"9,30%","11,31%",83,520.498.000,1.000.870,9,"1.470,94",15625,"10,62%","0,00%","Rodovia Br467, Br 163, Km 256.5, Jardim Europa, Toledo/PR, Brasil, 85907-060,Avenida Presidente Tancredo De Almeida Neves, 1171, Karfan, Itumbiara/GO, Brasil, 75516-475,Rodovia Br 242, Km 75, S/n, Zona Rural, Nova Ubirata/MT, Brasil, 78888-000,Rua Frutal 689, Centro, Iturama/MG, Brasil, 38280-971,Rodovia Pr 182, Km 34  Maripa/pr, Km 34,Perola Independente , Maripa/PR, Brasil, 85958-000,Estrada Da Pedreira, 151, 14 De Novembro, Cascavel/PR, Brasil, 85804-180,Rua Rio Verde, 101, Paul, Vila Velha/ES, Brasil, 29115-210,Rodovia Pr 364, Km 579, Palotina/PR, Brasil, 85950-000,Br 277, Km 533, Centro De Recebimento De Grão I.riedi, Colonia Murillo, Ibema/PR, Brasil, 85478-000"
BTCI11,Títulos e Val. Mob.,888,"16,17%","3,47%",88,883.748.000,959.159,0,000,000,"0,00%","0,00%",
BTCR11,Títulos e Val. Mob.,8800,"12,48%","11,20%",92,423.289.000,0,0,000,000,"0,00%","0,00%",
BTLG11,Híbrido,9360,"5,15%","9,41%",95,1.971.860.000,4.380.720,20,"3.953,92",18581,"4,70%","0,51%","Rua Dona Catharina Maria De Jesus, 400, Bonsucesso, Guarulhos/SP, Brasil, 07175-500,Estrada De Sao Goncalo, S/ Nº, Altura Aproximada Do Km 530, Humildes , Feira De Santana/BA, Brasil, 44135-000,Avenida Brigadeiro Faria Lima, 186, Pinheiros, Sao Paulo/SP, Brasil, 05426-200,Estrada Municipal Thereza Thomazella, 432, Bairro Dos Pires, Extrema/MG, Brasil, 00037-640,Estrada Ferreira Guedes, 784, Potuvera, Itapecerica Da Serra/SP, Brasil, 06885-150,Largo De Santana, 780, Santana, Sao Paulo/SP, Brasil, 02402-003,Estrada Rio Douro, 800, Mantiquira, Duque De Caxias/RJ, Brasil, 25245-810,Estrada Do Capuava, 1000, Chacara Ondas Verdes, Cotia/SP, Brasil, 06715-725,Rua Ronald Cladstone Negri, 557, Polo De Alta Tecnologia De Campinas Polo I, Campinas/SP, Brasil, 13069-472,Rodovia Ba535 Via Parafuso, Km 14, Cep 42849-000, Polo Logístico, Camacari/BA, Brasil, 42800-331,Br 116, 2271, Verife, Itaitinga/CE, Brasil, 61880-000,Rodovia Dom Gabriel Paulino Bueno Couto, Km 80,2, Esquina Com Via Dos Ipes, Bairro Do Jacaré, Cabreuva/SP, Brasil, 13315-000,Avenida Charles Goodyear, S/n, Cururuquara, Santana De Parnaiba/SP, Brasil, 06524-115,Rodovia Marechal Rondon, Km 536, 21500, Avenida, Aracatuba/SP, Brasil, 16027-231,Avenida Beirario, 5777, Distrito Industrial Deputado Simao Da Cunha, Santa Luzia/MG, Brasil, 33040-260,Rodovia Anhanguera, S/n, Km 308, Parque Residencial Candido Portinari, Ribeirao Preto/SP, Brasil, 14093-500,Rodovia Br470, 04, Machados, Navegantes/SC, Brasil, 88373-330,Avenida Alberto Soares Sampaio, S/n, Capuava, Maua/SP, Brasil, 09380-000,Avenida Francisco Roveri, S/n, Parque Almerinda Pereira Chaves, Jundiai/SP, Brasil, 13212-541,Rua Perola, 350, N/a, Jardim Santa Esmeralda, Hortolandia/SP, Brasil, 13186-546"
BTRA11,Outros,8393,"11,85%","11,68%",61,282.387.000,537.304,6,414,050,"12,17%","0,00%","Area Rural, Sn, N/a, Sao Desiderio/BA, Brasil, 47820-000,Rodovia Br 364, Km 888, Campo Novo Do Parecis/MT, Brasil, 78360-000,Zona Rural, S/n, Zona Rural, Tapurah/MT, Brasil, 78573-000,Zona Rural, S/n, Zona Rural, Nova Mutum/MT, Brasil, 78450-000,Area Rural, Sn, N/a, Nova Maringa/MT, Brasil, 78445-000,Zona Rural, S/n, Zona Rural, Campo Verde/MT, Brasil, 78840-000"
BTSG11,Híbrido,10000,"15,00%","5,28%",73,77.501.500,0,1,"4.109,85",66846,"16,26%","0,00%","Avenida dos Alecrins, 430, Distrito Industrial, Pouso Alegre, Minas Gerais, Brasil"
BTWR11,Lajes Corporativas,10700,"5,26%","4,88%",96,86.591.900,5,1,"4.292,25",24768,"5,77%","0,00%","Rua Qd. B-27, Av. Dep. Jamel Cecílio, 56 - Jardim Goiás, Goiânia"
BVAR11,Outros,10001,"84,44%","351,61%",8,62.560.300,0,63,49481,44143,"89,21%","7,46%","Rua Candido Mendes, 1.280 - Bairro Central,Av. Senhor dos Passos, 1.167 - Centro,Rua Imperatriz Tereza Cristina, 57 - Boa Vista,Pça Dom Epaminondas, 131 - Centro,Rua Manoel Correa, 76 - Centro,Av. Eduardo Ribeiro, 390 - Centro,Rua dos Americanos, 465 - Barra Funda,Rua 13 de Junho, 265 e Rua Antonio Joao, 59 (lojas 01 a 11),Rua Oswaldo Cruz, 132,Rua Sete de Setembro, 12/34 - Boa Vista,Rua Conselheiro João Alfredo, 68 - Centro,Rua dos Andradas, 1441 - Centro - Porto Alegre,Rua Marechal Deodoro, 102 - Centro,Rua Sete de Setembro, 142 - Centro,Rua do Comercio, 352 - Centro,Rua da Paz, 338 - Afogados,Rua Senador Teodoro Pacheco, 1.074 - Centro,Av. Sete de Setembro, 941-A - Centro,Rua Barão do Rio Branco, 118,Rua Imperatriz Terreza Cristina, 35 - Boa Vista,Av. Adolfo Pinheiro, 62 - Santo Amaro,Rua Major Facundo, 532 - Centro,Rua Antonio João, 59 - Lj 12 e 13 - Centro,Rua 13 de Junho, 265 - Centro,Av. Sete de Setembro, 238 - Centro,Av. Portugal, 221 - Centro,Rua Riachuelo, 360 - Centro,Pça XV de Novembro, 111,Rua Voluntários da Pátria, 29 - Centro,Rua Barão de Jundiaí, 955 - Centro,Av. Geronimo Monteiro, 299 - Centro,Pça Antonio Menck, 103 - Centro,Rua Carijós, 645 - Centro,Rua Grande, 517/523 - Centro,Rua Conselheiro João Alfredo, 38 Campina ,Rua Nova, 163 - Bairro Santo Antonio,Rua dos Andradas, 1.307 / 1.315 - Centro,Rua Regente Feijó, 1.037 - Centro,Av. Portugal, 213 - Centro,Rua da Azenha, 795 - Bairro Azenha,Av. Getulio Vargas, 258 - Centro,Rua Marechal Deodoro, 1.315 - Centro,Rua Antonio João, 59 - Lj 14 e 15 - Centro,Av. Sete de Setembro, 740 - Centro,Rua Serra Dourada, 102 - S. Miguel Paulista,Av. Paraná, 321 - Centro,Rua Visconde de Pirajá, 138 -A - Ipanema,Rua Desembargador Westphalen, 130 - Centro,Rua Dr. Deodato Wertheimer, 1.374 - Centro,Rua James Holland, 422 - Barra Funda,Rua Duque de Caxias, 222 - Santo Antonio,Rua Teodoro Sampaio, 2.382 - Pinheiros,Rua Marechal Deodoro, 900 - Centro,Rua Dias da Cruz, 155 - Meier,Rua Direita, 25 - Centro - SP,Av. Anhanguera, 5.520 - Bairro Setor Central,Av. Rio Branco, 637 - Cidade Alta,Rua Voluntários da Pátria, 167 - Centro,Av. 13 de Maio, 53 - Altos - Centro,Rua Maciel Pinheiro, 185 - Centro,Av. Presidente Kennedy, 09,Pça Ramos de Azevedo, 229,Rua João de Barros, 1812 - Encruzilhada "
CARE11,Híbrido,213,"-2,32%","0,00%",26,76.189.900,19.582,1,000,000,"0,34%","0,00%",
CBOP11,Lajes Corporativas,4208,"17,44%","14,81%",57,59.543.200,34.634,1,"3.583,72",26200,"7,31%","37,31%","Avenida Marcos Penteado Ulhôa Rodrigues, 939, Tamboré, Barueri - SP"
CCME11,Outros,9960,"3,45%","3,52%",99,248.510.000,1.241,0,000,000,"0,00%","0,00%",
CCRF11,Títulos e Val. Mob.,8564,"8,86%","13,80%",90,134.618.000,2.993,0,000,000,"0,00%","0,00%",
CEOC11,Lajes Corporativas,5458,"10,88%","11,27%",69,99.100.700,43.135,1,"7.685,92",99759,"12,98%","0,00%","Avenida Joao Cabral De Mello Neto, 850, 2º, 3º, 4º, 8º, 9º,10º,11º E 12º Andares, Barra Da Tijuca, Rio De Janeiro/RJ, Brasil, 22775-057"
CNES11,Lajes Corporativas,3000,"4,25%","4,22%",34,88.477.400,3.371,1,"1.270,10",17978,"14,15%","54,60%","Avenida Maria Coelho Aguiar, 215, Jardim Sao Luis, Sao Paulo/SP, Brasil, 05805-000"
CORM11,Híbrido,8100,"11,44%","5,90%",96,82.402.600,0,3,"7.561,03",73400,"9,71%","0,00%","Avenida Alfredo Egidio De Souza Aranha, 145, Edifício Souza Aranha Ii, Vila Cruzeiro, Sao Paulo/SP, Brasil, 04726-170,Avenida Alfredo Egidio De Souza Aranha, 145, Edifício Souza Aranha I, Vila Cruzeiro, Sao Paulo/SP, Brasil, 04726-170,Avenida Independencia, 565, Imóvel Porto Alegre, Independência, Porto Alegre/RS, Brasil, 00090-035"
CPFF11,Títulos e Val. Mob.,6016,"16,71%","11,63%",78,153.593.000,317.643,0,000,000,"0,00%","0,00%",
CPTS11,Títulos e Val. Mob.,7857,"0,75%","14,21%",89,2.497.180.000,6.119.760,0,000,000,"0,00%","0,00%",
CRFF11,Títulos e Val. Mob.,6392,"11,24%","11,24%",78,44.107.400,7.976,0,000,000,"0,00%","0,00%",
CTXT11,Lajes Corporativas,1139,"-18,74%","0,00%",33,35.942.200,3.520,1,75955,601,"0,79%","98,24%",Av. Roberto Zuccolo nº 555 Vila Leopoldina
CVBI11,Títulos e Val. Mob.,8988,"13,55%","13,79%",96,989.599.000,2.341.740,0,000,000,"0,00%","0,00%",
CXAG11,Outros,7639,"10,53%","11,07%",67,159.703.000,109.221,32,"2.769,94",32572,"11,76%","0,00%","R. 7 DE SETEMBRO 1231, CACHOEIRA DO SUL - RS,R DR SANTOS, 103, MONTES CLAROS - MG,R JOSE ALBERTO PELUCIO, 63, BAEPENDI - MG,R CARVALHO DE SOUSA, 283, RIO DE JANEIRO - RJ,R DR LUCIO MALTA, 585, JACAREÍ - SP,R GAL BENTO MARTINS, 2926, URUGUAIANA - RS,R JACARANDA, 499, IPATINGA - MG,R JULIO DE CASTILHOS, 189, SANTA CRUZ DO SUL - RS,AV CESARIO DE MELO, 3166, RIO DE JANEIRO - RJ,R SAO JOSE, 667, PIRACICABA - SP,AV PARAGUASSU, 1725, CAPÃO DA CANOA - RS,R JULIO DE CASTILHOS, 915, OSÓRIO - RS,AV BRIG.LUIS ANTONIO, 900, SÃO PAULO - SP,R DR SIQUEIRA, 342, MAGÉ - RJ,AV TIRADENTES, 387, ARAGUARI - MG,R JULIO DE CASTILHOS, 1029, LAJEADO - RS,AV NOSSA SENHORA DE COPACABANA, 427, RIO DE JANEIRO - RJ,AV PEDRO II, 244, SÃO LOURENÇO - MG,PC GIOVANI BREDA, 1916, SÃO BERNARDO DO CAMPO - SP,R VER. MARINHO HEMETERIO OLIVEIRA, 80, QUEIMADOS - RJ,R CEL. HORACIO ALVES PEREIRA, 225, ELÓI MENDES - MG,R QUINZE DE NOVEMBRO, 570, PELOTAS - RS,AV OSVALDO ARANHA, 1316, PORTO ALEGRE - RS,AV BARAO DO RIO BRANCO, 2340, JUIZ DE FORA - MG,PC APRIGIO DE TOLEDO, 16, ATIBAIA - SP,AV RUI BARBOSA, 790, MACAÉ - RJ,AV DANIEL JARDIM DE GRISOLIA, 117, ITABIRA - MG,R CEL FALKENBACH, 951, SOLEDADE - RS,AV TERESOPOLIS, 3235, PORTO ALEGRE - RS,R MIGUEL PRISCO, 40, RIBEIRÃO PIRES - SP,R COMERCIO, 660, FREDERICO WESTPHALEN - RS,AV DOM HELDER CAMARA, 5.809, RIO DE JANEIRO - RJ"
CXCE11B,Lajes Corporativas,3998,"11,79%","11,43%",61,68.483.700,15.485,1,"3.239,55",42465,"13,11%","0,00%","Av Presidente Vargas, 2655, Centro, Rio de Janeiro - RJ"
CXCI11,Títulos e Val. Mob.,7610,"2,74%","10,48%",84,156.593.000,97.489,0,000,000,"0,00%","0,00%",
CXCO11,Lajes Corporativas,6941,"12,60%","12,34%",70,272.400.000,156.074,10,"2.926,95",39152,"13,38%","0,00%","Rua Pouso Alegre, nº2.342, CEP 31010-514, Belo Horizonte, MG,Rua José Loureiro, nº195, CEP 80010-000, Curitiba, PR,Rua Barão de Melgaço, nº 3465, CEP 78005-300, Cuiabá, MT,Rua Bento Gonçalves, nº2463, CEP 93510-365, Novo Hamburgo, RS,Av Brasil, nº6.266, CEP 85810-000, Cascavel, PR,Rua 7 de setembro, nº1314, CEP 89010-204, BLUMENAU, SC,Rua dos Andradas, nº1000, CEP 90020-007, Porto Alegre, RS,Av Julio de Castilhos, nº1358, CEP 95010-000, Caxias do Sul, RS,Setor Bancario Sul, Quadra 1 Bloco L, PJ, nº28, CEP 70070-927, Brasília, DF,Av do contorno, nº8256, CEP 30170-050, Belo Horizonte, MG"
CXRI11,Títulos e Val. Mob.,6135,"11,33%","10,76%",76,96.672.900,15.590,0,000,000,"0,00%","0,00%",
CXTL11,Logística,39000,"1,54%","38,38%",82,20.902.800,6.521,1,"2.443,91",31159,"12,75%","0,00%","Rua Projetada A, 240, Distrito Industrial - Duque de Caxias/RJ"
DCRA11,Títulos e Val. Mob.,920,"8,60%","14,90%",96,62.177.500,231.098,0,000,000,"0,00%","0,00%",
DEVA11,Títulos e Val. Mob.,8690,"9,39%","15,10%",86,1.220.500.000,2.560.620,0,000,000,"0,00%","0,00%",
DRIT11B,Lajes Corporativas,8600,"8,79%","8,45%",65,39.841.800,281,6,"7.960,36",87455,"10,99%","7,79%","RUA JAMES JOULE, 65, SÃO PAULO - SP,AV DAS NAÇÕES UNIDAS, 19707, SÃO PAULO - SP,AV BRIGADEIRO FARIA LIMA, 1306, SÃO PAULO - SP,RUA DO RÓCIO, 350, SÃO PAULO - SP,ALAMEDA SANTOS, 787, SÃO PAULO - SP,RUA RAMOS BATISTA, 198, SÃO PAULO - SP"
DVFF11,Híbrido,6937,"6,02%","10,70%",79,76.372.900,22.780,0,000,000,"0,00%","0,00%",
EDGA11,Lajes Corporativas,2001,"8,12%","7,87%",33,76.279.200,29.552,1,"3.030,55",41999,"13,86%","42,64%","Rua Da Quitanda, 86, Sem Complemento, Centro, Rio De Janeiro/RJ, Brasil, 00020-091"
ELDO11B,Shoppings,"1.104,31","8,97%","3,41%",77,869.375.000,0,1,"11.433,00","1.231,51","10,77%","1,93%","Av. Rebouças, 3970, Pinheiros, São Paulo - SP"
EQIR11,Títulos e Val. Mob.,900,"12,38%","14,55%",93,45.225.000,39.015,0,000,000,"0,00%","0,00%",
ERPA11,Lajes Corporativas,12396,"3,67%","4,73%",90,62.094.300,14.254,1,"18.390,10","1.032,54","5,61%","0,00%","Avenida Europa, 105 - Jardim Paulista"
EURO11,Logística,23747,"9,51%","9,11%",73,91.173.300,79.354,7,77064,8045,"10,44%","0,00%","Rua Comandante Vergueiro da Cruz, 206,Rodovia Anhanguera , S/N KM 17,5,Av. Interlagos, 4455,Rodovia Anhanguera, s/n km 17,5,Av. Interlagos, 4.455,Rua Sargento Aquino, 136,Rua Sargento Aquino, 135/Rua Comandante Vergueiro da Cruz, 206"
EVBI11,Híbrido,9389,"8,09%","9,49%",94,157.104.000,25.041,8,"4.910,55",33437,"6,81%","0,00%","RUA PROFESSOR LUCAS GARZES, 2435, SÃO PAULO/ SP,Avenida das Américas nº 6205 - Rio de Janeiro, - RJ,Rua Augusto Tolle,Rua Pompeu Vairo, 200/300, São Paulo/SP,Rua Joaquim Nabuco, 374,Av. São Camilo,RUA PROFESSOR LUCAS GARZES, 2401, SÃO PAULO/ SP,Rua Tito, nº 671 - Bairro Vila Romana - São Paulo - SP"
FAED11,Outros,14800,"12,10%","12,20%",68,95.040.900,51.685,3,"2.500,45",32084,"12,83%","0,00%","Rua Waldemar Silenci, 340, Sem Complemento, Cidade Jardim, Leme/SP, Brasil, 13614-370,Rodovia Regis Bittencourt, 199, Sem Complemento, Centro, Taboão Da Serra/SP, Brasil, 06768-000,Alameda Maria Tereza, 2000, Dois Córregos, Dois Córregos, Valinhos/SP, Brasil, 13278-181"
