Papel,Segmento,Cotação,FFO Yield,Dividend Yield,P/VP,Valor de Mercado,Liquidez,Qtd de imóveis,Preço do m2,Aluguel por m2,Cap Rate,Vacância Média,Endereço
FAMB11B,Lajes Corporativas,71201,"-16,19%","0,00%",24,74.618.600,12.780,1,"1.230,13",000,"0,00%","100,00%","Avenida Almirante Barroso, 174, 1º Subsolo Até 31º Andar, Centro, Rio De Janeiro/RJ, Brasil, 20031-004"
FATN11,Híbrido,9490,"8,87%","10,59%",95,115.320.000,115.783,29,"22.743,30","1.793,04","7,88%","0,00%","Rua Funchal, 573,Rua Tabapuã, 500,Rua Gomes de Carvalho, 1108,Rua do Rócio, 351,Avenida Engenheiro Luís Carlos Berrini, 105,Rua Gomes de Carvalho, 1306,Av. Paulista, 2022,Rua Helena. 235,Av. das Nações Unidas, 11857,Rua Funchal, 513,Rua Tabapuã, 627,Rua Iaiá, 150,Av. Luiz Carlos Berrini, 1461,Rua Sansão Alves dos Santos, 76,AL. Campinas, 457,Rua Fidêncio Ramos, 100,Rua Pequetita, 215,Avenida Doutor Cardoso de Melo, 1340,Rua Arizona, 1366,Av. Dr. Cardoso de Melo, 1608,Rua Doutor Renato Paes de Barros, 717,Rua Dr. Cardoso de Melo, 1855 ,Av. Paulista, 2022,Avenida Brigadeiro Faria Lima, 1234,Avenida Presidente Juscelino Kubitschek, 1726,Avenida Paulista, 925,Rua Gomes de Carvalho, 1329,Rua do Rócio, 220,Rua Funchal, 129"
FCFL11,Outros,10900,"9,09%","8,95%",94,378.667.000,255.556,1,"12.203,10","1.182,61","9,69%","0,00%","Rua Quata, 300, Sem Complemento, Vila Olímpia, São Paulo/SP, Brasil, 04546-042"
FFCI11,Lajes Corporativas,18203,"2,32%","0,00%",87,671.817.000,0,9,"16.359,50",97104,"5,94%","22,84%","Rua da Candelária nº 65, Centro, Rio de Janeiro/RJ,Avenida Paulista, 37, São Paulo/SP,Rua Surubim, 373, Brooklin Novo, São Paulo/SP,Alameda Santos, 1.800 - Jardins,Alameda Santos, 1163, Cerqueira César, São Paulo/SP,Praia do Flamengo nº 154, Flamengo, Rio de Janeiro/RJ,Rua Olimpiadas. 205, São Paulo SP,Av. Juscelino Kubitschek, 510, Itaim Bibi, São Paulo/SP,Rua Girassol, 555  Vila Madalena"
FIGS11,Shoppings,4599,"10,35%","9,90%",60,131.072.000,125.989,2,"2.009,22",22056,"10,98%","11,12%","Av. Juscelino Kubitscheck de Oliveira, 5.308, Guarulhos - SP,Av. Bartolomeu de Castro, 230, Guarulhos - SP"
FIIB11,Híbrido,43999,"9,83%","9,46%",96,301.393.000,242.850,11,54367,5933,"10,91%","1,00%","R. D. Nelson N. Guimareaes, nº - Bairro Gloria - Joinville - SC,R. Silva Jardim, nº 0 - Bairro Atiradores-Joinville-SC,R. Alemanha, nº 0 - Bairro Gloria Joinville - SC,Rua Dona Francisca, 8.300 Distrito Industrial -.Joinville - SC,R. D. Nelson N. Guimareaes, nº - Bairro Gloria - Joinville - SC,R. Sd 40187, nº 0 - Bairro Gloria - Joinville - SC,R. Silva Jardim, nº 0 - Bairro Gloria-Joinville-SC,Rua Dr. Nelson N Guimarães, S/N - Bairro Gloria - Joinville - SC,R. Sd 40187, nº 0 - Bairro Gloria - Joinville - SC,R. Otto Berner, nº 0 - Baiiro Gloria-Joinville-SC.,R. D. Francisca, 8300 - Dist. Indl - Joinville -SC"
FIIP11B,Híbrido,14001,"11,73%","11,28%",75,129.812.000,69.684,7,"1.840,44",24769,"13,46%","0,00%","AVENIDA GENERAL DAVID -SARNOFF, Nº 4.840 - CONTAGEM  MG,RUA DR. MELLO FREIRE S/N - SÃO PAULO  SP,RUA ALFREDO PINTO Nº 91 - SÃO JOSÉ DOS PINHAIS  PR,RUA JOÃO FURLAN, S/Nº - OSASCO  SP,AV. RONAT WALTER SODRE, Nº 2.800 - IBIPORÃ - PR,AVENIDA NILO PEÇANHA Nº 296, ESQUINA COM A VIA LIGHT - NOVA IGUAÇU  RJ,RUA A , QUADRA D LOTES 11, 12 E 13 - ILHÉUS  BA"
FLCR11,Títulos e Val. Mob.,9585,"16,31%","14,71%",98,60.730.900,42.832,0,000,000,"0,00%","0,00%",
FLMA11,Híbrido,12300,"8,59%","8,31%",77,169.822.000,51.496,2,"9.644,19",91183,"9,45%","0,00%","Rua Tabapuã, 500,RUA DAS OLIMPIADAS, 205"
FLRP11,Shoppings,"1.605,00","8,08%","8,56%",88,104.697.000,9.562,1,"2.127,22",18240,"8,57%","1,33%","Rodovia Virgílio Várzea, 587 - Saco Grande II - Monte Verde - Florianópolis"
FMOF11,Lajes Corporativas,5500,"0,85%","0,81%",46,27.940.400,187,2,"1.654,58",15546,"9,40%","37,84%","Rua Júlio Gonzales, 132,Rua Julio Gonzales, 132"
FPAB11,Lajes Corporativas,13837,"14,33%","13,81%",37,103.778.000,16.896,2,"2.257,63",45296,"20,06%","29,24%","Avenida Francisco Matarazzo, 1500 ,Avenida Francisco Matarazzo, 1.500"
FPNG11,Lajes Corporativas,6862,"12,01%","11,68%",40,70.153.200,36,7,"7.733,85","1.096,02","14,17%","23,11%","Rua Tabapuã, 500,Rua Antonio de Albuquerque, 195 - Belo Horizonte MG,Rua Amazonas, 4338 - Belo Horizonte MG,Rua Paraiba, 550 25º and. Belo Horizonte MG,Rua Levindo Lopes, 258 Belo Horizonte MG,Rua Gonçalves da Guia, 8 - Itauna -MG,Rua Maria Luiza Santiago, 200 - Belo Horizonte MG"
FVBI11,Lajes Corporativas,15971,"0,00%","0,00%",0,0,0,1,000,63695,"0,00%","0,00%","Av. Brig. Faria Lima 4400, São Paulo, SP, 04551-060"
FVPQ11,Shoppings,9775,"9,89%","8,79%",51,273.715.000,49.258,1,"4.763,00",87380,"18,35%","4,40%","Av. Ayrton Senna, 3000, Barra da Tijuca, Rio de Janeiro - RJ"
GALG11,Híbrido,839,"11,52%","10,52%",90,482.302.000,400.081,5,"4.612,42",48885,"10,60%","0,00%","ESTRADA MUNICIPAL DO CAJURU, 655, São José dos Campos/SP,RODOVIA BR - 324, 13.750, SALVADOR/BA,RODOVIA PE 50, S/Nº, KM 02, Vitória de Santo Antão/PE,AV. FREDERICO AUGUSTO RITTER, 8.000, CACHOEIRINHA//RS,RUA DAVID CANABARRO S/Nº, Canoas/RS"
GAME11,Outros,877,"8,49%","14,59%",90,190.290.000,95.129,0,000,000,"0,00%","0,00%",
GCFF11,Títulos e Val. Mob.,6850,"13,18%","16,51%",86,23.194.000,24.527,0,000,000,"0,00%","0,00%",
GCRA11,Títulos e Val. Mob.,9480,"6,52%","16,30%",97,165.982.000,271.323,0,000,000,"0,00%","0,00%",
GCRI11,Títulos e Val. Mob.,9029,"12,64%","16,60%",96,107.516.000,125.417,0,000,000,"0,00%","0,00%",
GESE11B,Outros,"1.520,00","11,24%","11,26%",86,79.040.000,0,1,"6.178,75",72101,"11,67%","0,00%","Rua General Severiano, 159, Botafogo, Rio de Janeiro - RJ"
GGRC11,Logística,10455,"9,44%","10,75%",84,850.422.000,1.636.350,16,"1.082,79",11194,"10,34%","0,00%","Rua Maria Rufino dos Santos Medeiros, 201 Distrito Industrial - João Pessoa - PB,Guabirova, Pelotas - RS,LOTE C123,Rodovia Palmiro Paes de Barros, 290, Vista Alegre  Cuiabá - MT,Alameda das Aroreiras, nº 195, Casa Amarela, Betim - MG,Rua dos Portugueses,Rua Álvaro Camerin, nº 51, Distrito Industrial  Tietê - SP,Acesso pelo KM 117,5 Rodovia BR 101, Itajaí - SC,Avenida CTR Empresarial, KM 1.480 BR 497, Uberlândia-MG,Rodovia Federal BR 277, S/N KM 600+400, São Miguel do Iguaçu - PR,BR 153, nº 3469, Zona Urbana, Anápolis - GO,Rodovia BR 153, s/n, quadra AREA, lote 00C, anexo A, Jd. Paraíso I, Aparecida de Goiânia - GO,Avenida Amâncio Gaiolli, 1943 - Guarulhos - SP,Rua Antonio Felamingo, lote 6, quadra A - bairro Macuco, Valinhos-SP,Av. Maria Luiza Pompeo de Camargo, 333,Loteamento Polo Empresarial VTO Igarassu 1 - Igarassu - PE"
GSFI11,Shoppings,510,"0,00%","0,00%",36,383.510.000,42.615,0,000,000,"0,00%","0,00%",
GTWR11,Lajes Corporativas,7440,"12,32%","12,01%",79,892.800.000,674.071,3,"9.923,20","1.308,64","13,19%","0,00%","Setor de Autarquias Norte - Quadra 5 - Lote B - Brasilia / DF,Setor de Autarquias Norte - Quadra 5 - Lote B - Brasilia / DF,Setor de Autarquias Norte - Quadra 5 - Lote B - Brasilia / DF"
GWIR11,Shoppings,17599,"2,80%","0,00%",74,67.231.200,0,0,000,000,"4,21%","0,00%","Rua Manoel da Nobrega, 712, Centro, Diadema - SP"
HAAA11,Lajes Corporativas,6500,"10,55%","9,89%",73,224.575.000,1.917,2,"15.435,10","1.619,33","10,49%","16,93%","Avenida das Nações Unidas, nº 14.261  São Paulo, SP,Av. Engenheiro Luis Carlos Berrini, nº 105 - São Paulo, SP"
HABT11,Títulos e Val. Mob.,8784,"7,90%","15,56%",88,713.857.000,1.509.390,0,000,000,"0,00%","0,00%",
HBRH11,Híbrido,9209,"9,02%","8,48%",81,255.292.000,36.390,5,"8.459,79",83426,"9,86%","2,83%"," Rua Pequetita, 111, Cidade de São Paulo/SP, Av. Ayrton Senna, 2.500, Barra da Tijuca, na Cidade do Rio de Janeiro/RJ, Av. Domingos Odália Filho, 301, Cidade de Osasco/SP,Avenida Armando Lombardi, 400 Rio de Janeiro - RJ, Avenida Pereira Barreto nº 1.479, São Bernardo do Campo/SP"
HCHG11,Outros,8135,"6,47%","13,79%",80,97.620.000,18.223,0,000,000,"0,00%","0,00%",
HCRI11,Hospital,23899,"8,35%","8,22%",78,47.798.000,42.250,1,"8.671,90","1.178,82","13,59%","0,00%","Rua Das Perobas, 344, Vila Parque Jabaquara, São Paulo/SP, Brasil, 04321-120"
HCTR11,Títulos e Val. Mob.,8720,"10,84%","17,62%",72,1.925.740.000,4.939.830,0,000,000,"0,00%","0,00%",
HFOF11,Títulos e Val. Mob.,6500,"11,63%","11,25%",82,1.495.780.000,1.590.270,0,000,000,"0,00%","0,00%",
HGBS11,Shoppings,17878,"9,05%","8,83%",81,1.787.800.000,1.737.400,12,"3.501,57",31991,"9,14%","4,77%","Av. Francisco Matarazzo s/n, Bloco B, São Paulo - SP,R Dr. João Ribeiro, 304 - Penha de França, São Paulo - SP,Rua Cap. Pacheco e Chaves, 313 - Mooca, São Paulo - SP,Av. Rio Negro, 1.100, Franca - SP,Rua Sete de Setembro, 555 , Suzano - SP,Rua Manoel da Nobrega, 712, Centro, Diadema - SP,Rua Conselheiro Moreira de Barros, 2.780, São Paulo - SP,Av. José Monteiro Figueiredo, 500 - Duque de Caxias, Cuiabá - MT,Av. Santa Barbara, 777 - Vila Mollon IV, Santa Bárbara D Oeste - SP,Av. das Nações Unidas, 4777, São Paulo - SP,Av. Rotary, 624 - Centro, São Bernardo do Campo - SP,BR-116, 236 - Rio Branco, Novo Hamburgo - RS"
HGFF11,Títulos e Val. Mob.,6881,"11,70%","11,06%",81,197.044.000,537.673,0,000,000,"0,00%","0,00%",
HGIC11,Títulos e Val. Mob.,10000,"4,21%","12,20%",87,46.270.700,15.408,0,000,000,"0,00%","0,00%",
HGJH11,Lajes Corporativas,19129,"8,87%","0,00%",64,335.342.000,0,2,"26.470,10","2.561,57","9,68%","0,00%","Rua Amauri, 255 - São Paulo - SP,Rua Jerônimo da Veiga, 384 - São Paulo - SP"
HGPO11,Lajes Corporativas,24674,"6,87%","7,29%",82,432.549.000,470.518,2,"34.143,10","2.561,57","7,50%","0,00%","Rua Jerônimo da Veiga, 384 - São Paulo - SP,Rua Amauri, 255 - São Paulo - SP"
HGRE11,Lajes Corporativas,10987,"6,20%","8,67%",70,1.298.420.000,2.265.780,19,"6.556,24",54081,"8,25%","21,89%","Rua Antônio das Chagas, 1.657 - São Paulo - SP,Avenida Braz Leme, 1.000 - São Paulo - SP,Rua José Lari e Rua Pedro Mari, Lotes 13 a 23 - Taboão da Serra - SP,Alameda Campinas, 1.070 - São Paulo - SP,Av Dr Chucri Zaidan, 2460 - São Paulo - SP,Rodovia Dom Pedro I, Km 69 - Atibaia - SP,Avenida Eng. Carlos Berrini, 105 - São Paulo - SP,Rua Verbo Divino, 1.488 - São Paulo - SP,Rua Martiniano de Carvalho, 851 - São Paulo - SP,Rua Flórida, 1.595 - São Paulo - SP,Avenida Brigadeiro Faria Lima, 1.355 - São Paulo - SP,Av. Dolores Alcaraz Caldas, 90 - Porto Alegre - RS,Av. Presidente Vargas, 3.131 - Rio de Janeiro - RJ,Rua Francisco Nunes, 1.395 - Curitiba - PR,Rua Lauro Muller, 116 - Rio de Janeiro - RJ,Rua Alegria, 86 - São Paulo - SP,Avenida Marcos Penteado Ulhôa Rodrigues, 939 - Barueri - SP,Avenida das Nações Unidas, 11.633 - São Paulo - SP,Av. Maria Coelho Aguiar, 215 - São Paulo - SP"
HGRU11,Híbrido,11570,"8,28%","9,79%",94,2.129.630.000,3.551.380,73,"4.236,14",39043,"9,22%","0,00%","Rod. Raposo Tavares, 23.033, Granja Viana, SP,Rua Marechal Deodoro, 2785, Ferrazópolis, SP,Av. Bandeirantes, 892, Bandeirantes, PR,R. Dr. Pinheiro, 294/312, Itapeva, SP,R. Xv De Novembro, 0352, Paranaguá, PR,Estrada do Ribeira, 144, Atuba, PR,Rod. Melo Peixoto, 1314 - BR 369 - Km.159, Pq.Maracanã, Cambé, PR,R. Treze De Maio, 0186, Amparo, SP,Av. Condessa D Vimieiros, 17, Itanhaém, SP,Praça Rui Barbosa, 157, Olímpia, SP,R. Dr. Ataliba Leonel, 671, Taquarituba, SP,Av. Coronel Cacildo Arantes, 50, Parque Hiléia, Uberaba, MG,Av. Moisés Lupion, 610, Goioerê, PR,R. São Luiz, 693, Marília, SP,Rod. BR 230 - Km. 27, s/nº , Esplanada, João Pessoa, PB,Rua Sete de Setembro, 608 e 617, Piraju, SP,R. Vinte E Um De Abril, 162, Lins, SP,R. General Osório, 323, Ribeirão Preto, SP,Av. Paraná, 4195, Conjunto A, Foz do Iguaçu, PR,Av. Armando Lombardi, 940, Barra da Tijuca, RJ,Praça Attilio De Almeida Barbosa, 1156, Campo Largo, PR,Av. Dr. Soares De Oliveira, 280 e 272, 282 e 284 e Rua Dr. Getúlio Vargas, 305, Ituverava, SP,R. Governador Pedro De Toledo, 1162, Piracicaba, SP,Av. Professor Francisco Morato, 2585, Butantã, SP,Av. Angélica, 2563, Bela Vista, SP,R. Um De Março, 129, Barra Bonita, SP,R. José Bonifácio, 48, Itapira, SP,R. Presidente Antonio Carlos, 160, Passos, MG,Rod. Curitiba Ponta Grossa, km 65, Barigui, PR,Rua Miguel Petroni, 5.170, D.F. Embare Cabeceira do Can Can, São Carlos, SP,R. Dr. Gabriel Rib. Dos Santos, 40, Apiaí, SP,Ladeira Capitão Moraes, 49, Itapecerica da Serra, SP,R. Antonio Agu, 126/136, Osasco, SP,Praça Da Matriz, 106, Tatuí, SP,Rod. BR 050 Km 73, nº 7085, Fazenda Buriti, Uberlândia, MG,R. Dez, 482, Guaíra, SP,Av. Barão De Mauá, 74, Mauá, SP,Av.Garcia Rodrigues Paes(Acesso Norte),s/n-Área C4, Joquei Clube II, Juiz de Fora, MG,Av. Dr. Jorge Tibiriça, 565, Cruzeiro, SP,Praça Antonio Carlos, 190, Machado, MG,Praça Capitão Vicente Dias, 135, São José Do Rio Pardo, SP,Av. Imperatriz Leopoldina, 550, Vila Leopoldina, São Paulo, SP,Av. Joaquina Ramalho, 340, Vila Guilherme, SP,R. Floriano Peixoto, 575, Capão Bonito, SP,Av. Brasil, 1400, Ivaiporã, PR,R. Assis Figueiredo, 1422, Poços de Caldas, MG,Rua Padre Adelino, 685, Belém, SP,Rua Quatá, 67, Vila Olímpia, São Paulo, SP,R. Vinte, 776, Barretos, SP,Rua Amazonas Ribas, 402 e R. São Pedro, 1213, Itararé, SP,Av. Brasil, 1168, Pereira Barreto, SP,Rod. Dom Pedro I, km 132, Parque Imperador, SP,Av. Jabaquara, 2979, Mirandópolis, SP,R. Rui Barbosa, 0226, Araguari, MG,R. Campos Sales, 703, Itapetininga, SP,Praça Bom Jesus, 154, Palmas, PR,Av. Horácio Klabin, 205 e 215, Telêmaco Borba , PR,Av. Rio Branco, 511, Adamantina, SP,Av. Paraná, Esq. R. D. Pedro Ii, 112, Ibiporã, PR,R. Nove De Julho, 1223, Mirandópolis, SP,Rua Lúcia Viveiros, 4511, Neópolis, Natal, RN,Av. Presidente Roosevelt, 902, Dracena, SP,Av. Rio Grande Do Sul, 671, Marechal Cândido Rondon, PR,Av. Mate Laranjeiras, 496, Guaíra - PR, PR,Rod. Fernão Dias, 3700 - Km 3,5, Riacho Pedras, Contagem, MG,Av. Rui Barbosa, 447, Carapicuíba, SP,R. Bar"
HLOG11,Logística,8367,"9,99%","9,25%",72,355.598.000,41.687,5,"1.745,83",20407,"11,69%","1,26%","Rua Citlog, 333, Bairro Aeroporto, Varginha - MG,Rua Costa Barros, 3089, Vila Prudente, São Paulo - SP,Rodovia Engenheiro Ermínio de Oliveira Penteado, SP-073, Salto - SP,Galpão na Rodovia Miguel Melhado Campos, SP-324, Km 81,5, Itupeva - SP"
HMOC11,Shoppings,22695,"2,17%","0,00%",95,86.698.800,0,0,000,000,"3,27%","0,00%","Rua Manoel da Nobrega, 712, Centro, Diadema - SP"
HOFC11,Lajes Corporativas,2382,"15,18%","11,25%",26,90.015.800,138.457,4,"2.035,68",49597,"24,36%","40,29%","Rua Bela Cintra, 986, São Paulo - SP,Av. Morumbi, 8.234, São Paulo - SP,Alameda Santos, nº 1.039, São Paulo - SP,Av. das Nações Unidas, 17.891, São Paulo - SP"
HOSI11,Híbrido,6215,"8,97%","9,53%",67,35.639.900,417.057,0,000,000,"0,00%","0,00%",
HPDP11,Shoppings,7300,"7,81%","7,45%",82,212.343.000,1.725,1,"1.667,33",14178,"8,50%","0,88%","Av. Guilherme Campos 500, Campinas - SP"
HRDF11,Híbrido,093,"-0,80%","0,00%",75,7.056.030,327,0,000,000,"0,00%","0,00%",
HREC11,Títulos e Val. Mob.,7530,"14,01%","15,67%",85,388.304.000,538.647,0,000,000,"0,00%","0,00%",
HSAF11,Títulos e Val. Mob.,7590,"11,42%","15,58%",83,191.751.000,388.479,0,000,000,"0,00%","0,00%",
HSLG11,Logística,7730,"8,83%","10,46%",74,978.623.000,634.690,5,"2.007,82",19344,"9,63%","0,38%","Rodovia Coronel PM Nelson Tranchesi, números 740 e 990, no município de Itapevi, Estado de São Paulo,Rod. BR 116 (Contorno Leste), nº 7000, no município de São José dos Pinhais, Estado do Paraná,,Avenida Comendador Masatoshi Shinmyo, nº 300, no município de Arujá, estado de São Paulo,Avenida Torquato Tapajós, 5709 - Novo Israel, Manaus - AM,Rodovia Municipal Vereador Joaquim Costa, nº 2000, no município de Contagem, Estado de Minas Gerais"
HSML11,Shoppings,7950,"10,15%","9,94%",82,1.254.560.000,2.213.510,7,"8.255,79",70169,"8,50%","4,20%","Estrada da Floresta, 2320, CEP: 69912900, Floresta Sul, Rio Branco - AC,Avenida Luiz Viana, nº 8544, CEP 41730-101 - Alphaville - Salvador, BA,Av. dos Autonomistas, 1828 - Industrial Autonomistas, Osasco - SP, 06020-010,Av. Menino Marcelo, 3800 - Cidade Universitária, Maceió - AL, 57073-900,Rodovia Raposo Tavares, Km 23, CEP: 06709-015 Lageadinho - Cotia/SP ,Av. Santa Beatriz da Silva, 1501 - São Benedito Uberaba MG,Rua Paranabi, 218-224, CEP: 02307120, Tucuruvi, São Paulo-SP"
HTMX11,Hotel,10797,"9,21%","6,03%",78,162.423.000,287.210,24,"4.662,83",30826,"6,61%","0,00%","Av. Jandira 501, 107, São Paulo, SP, 04080-001,Rua Bandeira Paulista 555, 107, São Paulo, SP, 04532-011,R. Manuel Guedes 320, 107, São Paulo, SP, 04536-070,Av. Ibirapuera 2577, 107, São Paulo, SP, 04029-200,Rua Iguatemi 150, 107, São Paulo, SP, 01451-010,Av Roque Petroni Jr. 801, 107, São Paulo, SP, 04707-055,Av. Nove de Julho 3957, 107, São Paulo, SP, 01407-000,Rua Fernandes Moreira 1293, 107, São Paulo, SP, 04716-003,Rua Heinrich Hertz 14, 107, São Paulo, SP, 04575-000,Av. Eng. Luís Carlos Berrini 853, 107, São Paulo, SP, 04571-000,Rua João Cachoeira 111, 107, São Paulo, SP, 04535-010,Av. Briga Faria Lima 3989, 107, São Paulo, SP, 04538-133,Rua Fernandes Moreira 1371, 107, São Paulo, SP, 04716-003,Av. Paulista 2355, 107, São Paulo, SP, 01311-300,Rua da Consolação 2303, 107, São Paulo, SP, 01301-100,Rua Guararapes 1889, 107, São Paulo, SP, 04561-004,Alameda Campinas 540, 107, São Paulo, SP, 01404-000,R. Funchal 281, 107, São Paulo, SP, 04551-060,Rua Quintana 963, 107, São Paulo, SP, 04569-011,Rua Vergueiro 2740, 107, São Paulo, SP, 04102-001,Rua Haddok Lobo 294, 107, São Paulo, SP, 01414-000,Rua Tavares Cabral 61, 107, São Paulo, SP, 54223-030,Rua Baronesa de Bela Vista, 801, Vila Congonhas, São Paulo, SP, 04612-002,Rua Arizona 1517, 107, São Paulo, SP, 04567-010"
HUCG11,Hospital,6600,"9,04%","9,58%",65,74.052.000,7.105,2,"1.115,46",000,"0,00%","0,00%","Rua Denise Alves de Medeiros Campina Grande - Paraíba,Rua Denise Alves de Medeiros Campina Grande - Paraíba"
HUSC11,Outros,10000,"10,30%","10,02%",68,79.461.300,6.419,1,"1.070,35",13803,"12,90%","0,00%","Rodovia Cachoeiro - Safra BR 482 - Km 05, Bairro: Fazenda União - Cachoeiro do Itapemerim/ES"
IAGR11,Títulos e Val. Mob.,9848,"9,58%","1,36%",95,24.191.700,9.610,0,000,000,"0,00%","0,00%",
IBCR11,Títulos e Val. Mob.,7700,"11,71%","17,47%",82,73.798.600,205.836,0,000,000,"0,00%","0,00%",
IBFF11,Títulos e Val. Mob.,6640,"8,28%","3,68%",93,44.267.600,0,0,000,000,"0,00%","0,00%",
IDFI11,Híbrido,5381,"15,44%","88,12%",97,110.737.000,3.128,1,000,000,"0,00%","0,00%",
IFIE11,Títulos e Val. Mob.,7198,"14,26%","0,00%",95,64.817.600,0,0,000,000,"0,00%","0,00%",
IRDM11,Títulos e Val. Mob.,9035,"12,00%","14,29%",98,3.291.800.000,4.940.610,0,000,000,"0,00%","0,00%",
IRIM11,Híbrido,9190,"11,96%","15,95%",94,176.448.000,54.213,0,000,000,"0,00%","0,00%",
ITIP11,Títulos e Val. Mob.,7599,"21,85%","14,02%",95,56.852.000,65.743,0,000,000,"0,00%","0,00%",
ITIT11,Títulos e Val. Mob.,7420,"13,83%","9,23%",98,66.816.700,56.339,0,000,000,"0,00%","0,00%",
JASC11,Outros,10100,"2,23%","2,59%",86,183.849.000,2,6,"9.146,66",988,"0,11%","0,00%","Avenida Sargento Hermínio, Ceara,Av. 13 de maio, 755, Bairro de Fátima - Fortaleza - CE,Av Deputado Oswaldo Studart com a Treze de Maio, cidade de Fortaleza, estado do Ceará,Avenida Godofredo Maciel, nº 2.560,Av. Washington Soares, 3535, Bairro: Edson Queiroz/ Fortaleza-CE,Avenida Sargento Hermínio, Ceara"
JFLL11,Residencial,5900,"19,65%","12,61%",58,88.535.300,96.920,2,"5.963,94","1.258,94","21,11%","39,05%","Av. Dr. Cardoso de Melo, 699, Vila Olímpia, São Paulo  SP,Av. Eusébio Matoso, 218 - Pinheiros, São Paulo - SP"
JGPX11,Híbrido,9545,"10,81%","13,48%",99,80.950.900,179.435,0,000,000,"0,00%","0,00%",
JPPC11,Híbrido,13000,"-5,80%","5,24%",36,7.150.000,344,0,000,000,"0,00%","0,00%",
JRDM11,Shoppings,7849,"8,26%","9,12%",88,198.028.000,25.738,1,"6.786,78",69164,"10,19%","1,20%","Avenida Giovanni Gronchi, 5819, Vila Andrade, São Paulo/SP, Brasil, 05724-003"
JSAF11,Títulos e Val. Mob.,7810,"11,84%","12,95%",85,122.855.000,382.019,0,000,000,"0,00%","0,00%",
JSRE11,Híbrido,6324,"9,13%","9,19%",56,1.313.330.000,2.318.120,6,"11.103,60","1.192,72","10,74%","8,84%","Av. Das Nações Unidas, 14171, São Paulo - SP,Av. Das Nações Unidas, 14171, São Paulo - SP,Av. Jornalista Roberto Marinho, 85, Cidade Monções, Sao Paulo - SP,Praia de Botafogo, 440, Botafogo, Rio de Janeiro - RJ,Av. Paulista, 2064, Bela Vista, São Paulo - SP,Rua Eugênio de Medeiros, 303, Pinheiros, São Paulo - SP"
KCRE11,Títulos e Val. Mob.,9155,"8,81%","8,23%",94,329.580.000,540.706,0,000,000,"0,00%","0,00%",
KFOF11,Títulos e Val. Mob.,7781,"11,10%","10,77%",88,352.737.000,804.519,0,000,000,"0,00%","0,00%",
KISU11,Títulos e Val. Mob.,794,"11,49%","11,34%",93,350.917.000,804.458,0,000,000,"0,00%","0,00%",
KIVO11,Títulos e Val. Mob.,8701,"9,24%","16,59%",90,105.728.000,188.564,0,000,000,"0,00%","0,00%",
KNCR11,Títulos e Val. Mob.,9877,"8,09%","13,36%",98,5.639.480.000,10.642.100,0,000,000,"0,00%","0,00%",
KNHY11,Títulos e Val. Mob.,9665,"9,47%","13,08%",99,1.787.140.000,2.426.780,0,000,000,"0,00%","0,00%",
KNIP11,Títulos e Val. Mob.,9099,"5,78%","12,88%",97,7.286.310.000,7.389.110,0,000,000,"0,00%","0,00%",
KNRE11,Residencial,066,"53,50%","47,55%",87,12.241.100,9.739,0,000,000,"0,00%","0,00%",
KNRI11,Híbrido,13657,"7,98%","7,81%",85,3.299.140.000,3.052.420,20,"4.109,37",34599,"8,42%","0,10%","Estrada da Lama Preta, 2.805, Santa Cruz, Rio de Janeiro - RJ,Rua do Níquel, 205, Parque Industrial, Itaquaquecetuba - SP,Rua Buenos Aires, 15, Centro, Rio de Janeiro - RJ,Rodovia Vice Prefeito Hermenegildo Tonolli, km 2, Jundiaí - SP,Rua Gomes de Carvalho, 1.195, Vila Olimpia, São Paulo - SP,Rua Diogo Moreira, 184, São Paulo - SP,Rua Dr. Fernandes Coelho, 64, Pinheiros, São Paulo - SP,Rodovia Mogi-Dutra (SP-088), 11.100 (km 41,4), Mogi das Cruzes - SP,Rodovia dos Bandeirantes, km 69, Louveira - SP,Avenida Parque Industrial, 580, Sumaré - SP,Rua Voluntários da Pátria, 113, Botafogo, Rio de Janeiro - RJ,Av. Nações Unidas, 14.171 , São Paulo - SP,Rua Joaquim Floriano, 913, Itaim Bibi, São Paulo - SP,Avenida Paulista, 2.421, Bela Vista, São Paulo - SP,Rodovia Fernão Dias, km 863, Algodão, Pouso Alegre - MG,Rod. Dom Gabriel Paulino Bueno Couto, km 82 - Cabreúva - SP28,42,Avenida dos Andradas, 3000, Santa Efigênia, Belo Horizonte - MG,Avenida Caminho de Goiás, 100, Rodovia Anhanguera, km 66, Jundiaí - SP,Rua Humaitá, 275, Humaitá, Rio de Janeiro - RJ,Avenida Presidente Juscelino Kubitschek, 1.830, São Paulo - SP"
KNSC11,Títulos e Val. Mob.,8618,"8,21%","12,54%",98,1.144.110.000,3.914.460,0,000,000,"0,00%","0,00%",
LASC11,Shoppings,10500,"7,16%","7,89%",99,308.731.000,3.856,2,"4.106,45",34437,"8,39%","2,68%","Avenida Visc. de Souza Franco, 776 - Reduto, Belém - PA, 66053-0,Avenida, Dr. Silvio Bastos Tavares, 330 - Parque dos Rodoviários, Campos dos Goytacazes - RJ, 28051-250"
LATR11B,Residencial,1000,"-15,56%","0,00%",93,1.241.040,0,0,000,000,"0,00%","0,00%","Rua Santa Isabel, nº 272, Higienópolis, São Paulo - SP"
LGCP11,Logística,7499,"14,81%","9,74%",73,204.937.000,219.740,5,"2.520,22",38499,"15,28%","0,33%","Rod BR 153, S/N Compl. KM 5.5 QD CH LT SALA 01- Bairro Fazenda Retiro CEP: 74.620-430 Goiânia  GO ,RUA SIMAO ANTONIO, 255  CINCAO CEP: 32.371-610 - CONTAGEM  MG,AV. BRASIL, n.41.432 LOT 1 PARTE 2 PAL 48862 LOT 1 PARTE 1 PAL 48862 Bairro CAMPO GRANDE - Rio de Janeiro - RJ- CEP: 23.078-001,RUA AMÂNCIO GAIOLLI, 426 - ÁGUA CHATA CEP:07.251-250 - GUARULHOS - SP,RODOVIA BR 262, nº 222 VILA BETANIA CEP: 29.136-930 VIANA/ES"
LSPA11,Outros,10733,"12,43%","6,40%",94,43.415.000,0,0,000,000,"0,00%","0,00%",
LUGG11,Residencial,7161,"11,55%","9,20%",61,80.969.900,21.511,4,"3.533,51",56488,"15,99%","1,23%","Rua das Espatodias 610, Marajó - Belo Horizonte - MG,Rua Casemiro Augusto Rodacki, 289, Cidade Industrial - Curitiba - PR,Rua Capitão João Zaleski, 842, Lindoia - Curitiba - PR,Rua Santa Maria Rosselo, 180, Mansões Santo Antonio - Campinas - SP"
LVBI11,Logística,9431,"9,63%","9,37%",82,1.110.520.000,2.102.400,9,"2.761,23",29196,"10,57%","0,51%","Rodovia Anhanguera, km 43, Cajamar, São Paulo,Avenida Portugal, 400, Itaqui, Itapevi/SP, Brasil, 06696-060,Avenida Papa João XXIII, 3059, Loteamento Industrial Coral, Maua/SP, Brasil, 09370-800,Avenida Juiz Marco Tulio Isaac, 7001, Riacho Da Areia, Betim/MG, Brasil, 32671-072,Rua Manoel Borba Gato, 100, Esplanada Das Bandeiras, Guarulhos/SP, Brasil, 07044-220,Estrada Dos Alpes, 320, Jandira, Barueri/SP, Brasil, 00006-423,Rua Pedro De Alcantara Meira, 1001, Fazenda Velha, Araucaria/PR, Brasil, 83704-530,Rodovia Fernão Dias, KM 947.5, Extrema, MG, 37640-000,Avenida Mutinga 4935, Bairro Pirituba, Pirituba, São Paulo/SP, Brasil, 05110-903"
MALL11,Shoppings,9898,"14,85%","9,12%",82,903.159.000,1.444.710,9,"3.573,52",49889,"13,96%","3,67%",":R. Jacy Teixeira de Camargo, 940 - Jardim do Lago, Campinas - SP, 13050-913,Av. Gov. Agamenon Magalhães, 153 - Santo Amaro, Recife - PE, 50110-000,Rod. dos Metalúrgicos, 1189 - São Geraldo, Volta Redonda - RJ, 27253-005,Av. Comendador Gustavo Paiva, 2990 - Mangabeiras, Maceió - AL, 57032-901,R. Sete de Setembro, 555 - Jardim dos Ipês, Suzano - SP, 08674-210,Estrada do Portela, nº 222, Madureira, Rio de Janeiro - RJ,Av. João Durval Carneiro, 3665, Caseb - Feira de Santana - BA,Rod. Régis Bittencourt, 2643, Jardim Helena - Taboão da Serra - SP,Av. Henrique Terra, 1700 - Palmeiras, Cabo Frio - RJ, 28911-320"
MATV11,Títulos e Val. Mob.,8011,"10,97%","15,90%",88,34.124.300,10.598,0,000,000,"0,00%","0,00%",
